{
  "schema_version": "kb-resolve-result/v1",
  "request_id": "req-20260312-deploy-001",
  "created_at": "2026-03-12T09:16:02Z",
  "repo_branch": "releases/v0.13.0",
  "repo_sha": "9f5a2e1",
  "paired_vllm_ref": "vllm@0.8.5",
  "runtime_tuple": {
    "soc": "A2",
    "cann": "8.0.RC3",
    "torch": "2.5.1",
    "torch_npu": "2.5.1.post1",
    "python": "3.10"
  },
  "match_level": "compatible",
  "selected_shards": [
    "repo_semantics",
    "validation"
  ],
  "warnings": [
    "runtime tuple exact match unavailable; using compatible validation shard"
  ],
  "missing": [
    "exact runtime tuple baseline"
  ],
  "notes": null
}
